{
  "dia": [
    {
      "pagina": "/",
      "entradas": 1269
    },
    {
      "pagina": "/orgao/detrandepartamento-estadual-de-transito-de-mato-grosso-do-sul151/8",
      "entradas": 321
    },
    {
      "pagina": "/transito-e-transportes/emitir-guia-de-licenciamento-anual100/",
      "entradas": 303
    },
    {
      "pagina": "/direitos-e-cidadania/expedicao-de-carteira-de-identidade127",
      "entradas": 277
    },
    {
      "pagina": "/orgao/jucemsjunta-comercial-do-estado-de-mato-grosso-do-sul118/servicos",
      "entradas": 171
    },
    {
      "pagina": "/empresa-industria-e-comercio/pesquisar-viabilidade198/",
      "entradas": 143
    },
    {
      "pagina": "/orgao/sefaz-mssecretaria-de-estado-de-fazenda-de-mato-grosso-do-sul87/servicos",
      "entradas": 122
    },
    {
      "pagina": "/financas-e-impostos/portal-e-fazenda-cadastro135/",
      "entradas": 121
    },
    {
      "pagina": "/workspace",
      "entradas": 121
    },
    {
      "pagina": "/empresa-industria-e-comercio/emitir-certidao-simplificada-digital84/",
      "entradas": 104
    }
  ],
  "semana": [
    {
      "pagina": "/",
      "entradas": 6298
    },
    {
      "pagina": "/transito-e-transportes/emitir-guia-de-licenciamento-anual100/",
      "entradas": 1936
    },
    {
      "pagina": "/orgao/detrandepartamento-estadual-de-transito-de-mato-grosso-do-sul151/8",
      "entradas": 1918
    },
    {
      "pagina": "/direitos-e-cidadania/expedicao-de-carteira-de-identidade127",
      "entradas": 1647
    },
    {
      "pagina": "/orgao/jucemsjunta-comercial-do-estado-de-mato-grosso-do-sul118/servicos",
      "entradas": 800
    },
    {
      "pagina": "/empresa-industria-e-comercio/pesquisar-viabilidade198/",
      "entradas": 627
    },
    {
      "pagina": "/orgao/sefaz-mssecretaria-de-estado-de-fazenda-de-mato-grosso-do-sul87/servicos",
      "entradas": 606
    },
    {
      "pagina": "/seguranca/delegacia-virtual-devir105/",
      "entradas": 604
    },
    {
      "pagina": "/financas-e-impostos/ipva-consulta-de-debito54/",
      "entradas": 586
    },
    {
      "pagina": "/financas-e-impostos/portal-e-fazenda-cadastro135/",
      "entradas": 579
    }
  ],
  "mes": [
    {
      "pagina": "/",
      "entradas": 22507
    },
    {
      "pagina": "/transito-e-transportes/emitir-guia-de-licenciamento-anual100/",
      "entradas": 7487
    },
    {
      "pagina": "/orgao/detrandepartamento-estadual-de-transito-de-mato-grosso-do-sul151/8",
      "entradas": 7176
    },
    {
      "pagina": "/direitos-e-cidadania/expedicao-de-carteira-de-identidade127",
      "entradas": 6713
    },
    {
      "pagina": "/orgao/jucemsjunta-comercial-do-estado-de-mato-grosso-do-sul118/servicos",
      "entradas": 3020
    },
    {
      "pagina": "/financas-e-impostos/ipva-consulta-de-debito54/",
      "entradas": 2382
    },
    {
      "pagina": "/orgao/sefaz-mssecretaria-de-estado-de-fazenda-de-mato-grosso-do-sul87/servicos",
      "entradas": 2365
    },
    {
      "pagina": "/empresa-industria-e-comercio/pesquisar-viabilidade198/",
      "entradas": 2364
    },
    {
      "pagina": "/financas-e-impostos/portal-e-fazenda-cadastro135/",
      "entradas": 2290
    },
    {
      "pagina": "/seguranca/delegacia-virtual-devir105/",
      "entradas": 1826
    }
  ],
  "ano": [
    {
      "pagina": "/",
      "entradas": 1099545
    },
    {
      "pagina": "/orgao/detrandepartamento-estadual-de-transito-de-mato-grosso-do-sul151/8",
      "entradas": 271355
    },
    {
      "pagina": "/transito-e-transportes/emitir-guia-de-licenciamento-anual100/",
      "entradas": 164227
    },
    {
      "pagina": "/workspace/minha-area/meus-sistemas",
      "entradas": 132251
    },
    {
      "pagina": "/direitos-e-cidadania/expedicao-de-carteira-de-identidade127",
      "entradas": 116348
    },
    {
      "pagina": "/noticias/ - Others",
      "entradas": 111059
    },
    {
      "pagina": "/orgao/sefaz-mssecretaria-de-estado-de-fazenda-de-mato-grosso-do-sul87/servicos",
      "entradas": 97927
    },
    {
      "pagina": "/financas-e-impostos/portal-e-fazenda-cadastro135/",
      "entradas": 69720
    },
    {
      "pagina": "/financas-e-impostos/ipva-consulta-de-debito54/",
      "entradas": 67302
    },
    {
      "pagina": "/workspace",
      "entradas": 65110
    }
  ]
}